{
  "schema_version": 1,
  "project_id": "arif-salah-image-gen-kazuma",
  "source_id": "github-1132967377",
  "source_identity": "github:arif-salah/image-gen-kazuma",
  "evidence_fingerprint": "a07a0bdc69c66ab02ac1db20e517e8cfc5d9dc0597c872c132ae098ea178c70c",
  "policy_version": "2026-07-29",
  "status": "review-unavailable",
  "category": null,
  "reviewed_at": "2026-08-07T08:41:33.307Z",
  "retry": {
    "attempts": 1,
    "last_failure_at": "2026-08-07T08:41:33.307Z"
  },
  "maintenance_issue_number": null
}
