{
  "schema_version": 1,
  "project_id": "dfaker-st-mode-toggles",
  "source_id": "github-1039962099",
  "source_identity": "github:dfaker/st-mode-toggles",
  "evidence_fingerprint": "7d3bad387b6c045ce5f1a4894b6805b2a1d83bfa3512f41dee4b6e51fe7d9eaa",
  "policy_version": "2026-07-29",
  "status": "review-unavailable",
  "category": null,
  "reviewed_at": "2026-08-11T04:37:22.650Z",
  "retry": {
    "attempts": 1,
    "last_failure_at": "2026-08-11T04:37:22.650Z"
  },
  "maintenance_issue_number": null
}
