{
  "schema_version": 1,
  "project_id": "virgilianshailer-llm-tools",
  "source_id": "github-1251530217",
  "source_identity": "github:virgilianshailer/llm-tools",
  "evidence_fingerprint": "67c135543ed0c3567d28dbc43c18f67f4a35efc0366d8e4131b574f0e0ea1903",
  "policy_version": "2026-07-29",
  "status": "review-unavailable",
  "category": null,
  "reviewed_at": "2026-09-27T13:21:18.197Z",
  "retry": {
    "attempts": 2,
    "last_failure_at": "2026-09-27T13:21:18.197Z"
  },
  "maintenance_issue_number": null
}
