{
  "schema_version": 1,
  "project_id": "doomedskull1011-sillytavernandroid",
  "source_id": "github-1359516136",
  "source_identity": "github:doomedskull1011/sillytavernandroid",
  "evidence_fingerprint": "721623980705446362341d892b5d1636fdfe4331febb405361a6db8f5cd7ae16",
  "policy_version": "2026-07-29",
  "status": "review-unavailable",
  "category": null,
  "reviewed_at": "2026-10-02T19:45:27.809Z",
  "retry": {
    "attempts": 1,
    "last_failure_at": "2026-10-02T19:45:27.809Z"
  },
  "maintenance_issue_number": null
}
