{
  "schema_version": 1,
  "project_id": "maiky93-image-generation-suite",
  "source_id": "github-1294348279",
  "source_identity": "github:maiky93/image-generation-suite",
  "evidence_fingerprint": "d2459cadf6561cd81ff6bf0cf0d811c892f03b91ed8e68496a8a883682a6a917",
  "policy_version": "2026-07-29",
  "status": "clear",
  "category": null,
  "reviewed_at": "2026-11-01T05:44:03.246Z",
  "retry": { "attempts": 0, "last_failure_at": null },
  "maintenance_issue_number": null
}
