{
  "schema_version": 1,
  "project_id": "icefog72-sillytavern-everytextlineeditor",
  "source_id": "github-1240388057",
  "source_identity": "github:icefog72/sillytavern-everytextlineeditor",
  "evidence_fingerprint": "cd55ab65904aae89b9fe831cf78bfb365c4f61397c3d4b1688819eb3b9c85ca8",
  "policy_version": "2026-07-29",
  "status": "review-unavailable",
  "category": null,
  "reviewed_at": "2026-09-19T12:14:23.662Z",
  "retry": {
    "attempts": 3,
    "last_failure_at": "2026-09-19T12:14:23.662Z"
  },
  "maintenance_issue_number": null
}
