{
  "schema_version": 1,
  "project_id": "rustyorb-preset-forge",
  "source_id": "github-1338955728",
  "source_identity": "github:rustyorb/preset-forge",
  "evidence_fingerprint": "2a62066d3fc8c5ef584be6c1ef2cd3e6c2e7497e21c74f0058ce843603150663",
  "policy_version": "2026-07-29",
  "status": "review-unavailable",
  "category": null,
  "reviewed_at": "2026-08-20T16:50:25.116Z",
  "retry": {
    "attempts": 1,
    "last_failure_at": "2026-08-20T16:50:25.116Z"
  },
  "maintenance_issue_number": null
}
