{
  "schema_version": 1,
  "project_id": "p-e-w-waidrin",
  "source_id": "github-1014687651",
  "source_identity": "github:p-e-w/waidrin",
  "evidence_fingerprint": "cc6092ee7201a9f8951e48b4fd6941139ba63420372123e4d37c68076e2ceb2b",
  "policy_version": "2026-07-29",
  "status": "clear",
  "category": null,
  "reviewed_at": "2026-11-01T13:04:15.713Z",
  "retry": { "attempts": 0, "last_failure_at": null },
  "maintenance_issue_number": null
}
